[
	{
		"enabled": true,
		"rule": "REWRITE",
		"name": "",
		"pattern": "",
		"rewriteReplaceWith": "https://example.com/$1"
	},
	{
		"enabled": true,
		"rule": "DEEPDECRYPT",
		"name": "",
		"pattern": "",
		"deepPattern":  "(https?://absolute\\.url\\.example\\.com/subdir1/.*?\\.ext)",
		"passwordPattern": "password:([^>]+)>",
		"packageNamePattern": "<title>(.*?)</title>"
	}
]